{
  "artifact_type": "sae_certificate",
  "created_at": "2026-07-26T05:02:08Z",
  "created_by": {
    "code_commit": "7db65182eb31c61e15307547bf75bb84c701293a",
    "entrypoint": "interplab.jobs.certify",
    "host": "tamia",
    "run_id": "r20260726-0354-b343"
  },
  "payload": {
    "bands_version": 1,
    "eval_slice": {
      "corpus": {
        "content_hash": "sha256:88740b7463610b932917b5a0b0ebe81959cd4170cffe6b36fa229b0df64239dc",
        "location": "local:data/raw/fineweb_subset"
      },
      "disjointness": "by_offset_argument",
      "n_tokens": 9999872,
      "selection": {
        "method": "stream_offset",
        "params": {
          "count": 25000,
          "offset": 601369
        }
      }
    },
    "metrics": {
      "ce_recovered": 0.978478101519016,
      "dead_fraction": 3.0517578125e-05,
      "density_histogram": {
        "bin_edges_log10": [
          -8.0,
          -7.84,
          -7.68,
          -7.52,
          -7.36,
          -7.2,
          -7.04,
          -6.88,
          -6.72,
          -6.5600000000000005,
          -6.4,
          -6.24,
          -6.08,
          -5.92,
          -5.76,
          -5.6,
          -5.4399999999999995,
          -5.279999999999999,
          -5.12,
          -4.96,
          -4.8,
          -4.640000000000001,
          -4.48,
          -4.32,
          -4.16,
          -4.0,
          -3.84,
          -3.6799999999999997,
          -3.5199999999999996,
          -3.3600000000000003,
          -3.2,
          -3.04,
          -2.88,
          -2.7199999999999998,
          -2.5599999999999996,
          -2.3999999999999995,
          -2.24,
          -2.08,
          -1.92,
          -1.7599999999999998,
          -1.5999999999999996,
          -1.4399999999999995,
          -1.2800000000000002,
          -1.12,
          -0.96,
          -0.7999999999999998,
          -0.6399999999999997,
          -0.47999999999999954,
          -0.3200000000000003,
          -0.16000000000000014,
          0.0
        ],
        "counts": [
          0,
          0,
          0,
          0,
          0,
          0,
          5,
          0,
          8,
          9,
          44,
          169,
          447,
          930,
          1832,
          2625,
          3217,
          4144,
          5683,
          7590,
          9776,
          12037,
          13408,
          14079,
          14244,
          12709,
          11181,
          9304,
          8114,
          7205,
          6253,
          5380,
          4344,
          3355,
          2285,
          1348,
          865,
          480,
          326,
          176,
          115,
          63,
          29,
          16,
          12,
          7,
          5,
          1,
          6,
          9
        ]
      },
      "fvu": 0.04412478561621764,
      "max_decoder_cosine_p999": 0.5958738327026367,
      "per_position_fvu": [
        0.00836513617480169,
        0.023634602769401065,
        0.10353846701833191,
        0.16192128623047883,
        0.18172716067943287,
        0.20478407577266006,
        0.20734553873413603,
        0.21015491714512138,
        0.21277226744205058,
        0.21544888368882745,
        0.2197497231088846,
        0.2224349835544925,
        0.22343140050178548,
        0.22468335314272792,
        0.22625047286619154,
        0.22805611303840287,
        0.22925717959714467,
        0.2303092858882198,
        0.23203698894100383,
        0.23379421829796815,
        0.23233052137649027,
        0.2348135936764277,
        0.23612145436393014,
        0.2366846459239269,
        0.23756666810231228,
        0.23925329827521058,
        0.2390821245154084,
        0.23933889327051136,
        0.24005987764476483,
        0.2398081888393785,
        0.241278022475307,
        0.24169221615494788,
        0.24182788149037446,
        0.24250203370553508,
        0.24288580979583,
        0.2424908266934093,
        0.2436013935630915,
        0.2432817590768822,
        0.24337955770064362,
        0.2446023836357391,
        0.24496214613999276,
        0.24534056877242566,
        0.2454437086143123,
        0.24539809736566984,
        0.24530338449465564,
        0.2448835059001424,
        0.24583759028983768,
        0.24518204808952365,
        0.24557801616243013,
        0.24547266784515964,
        0.24600495735691472,
        0.24580058845135308,
        0.24683719175366145,
        0.24719031230333188,
        0.2473475407550221,
        0.24759469024800718,
        0.24783070108908528,
        0.24804097252737312,
        0.2480225355372144,
        0.24827380694849202,
        0.24763326816635886,
        0.24832288344476436,
        0.24763309639034062,
        0.24825682033719446,
        0.2472212941140103,
        0.24817539880954742,
        0.2487846953571897,
        0.24900250617272818,
        0.2485882385930466,
        0.2489679418118752,
        0.24910455991871494,
        0.24839440675024835,
        0.2485935729224302,
        0.24906959734533224,
        0.2468588145096017,
        0.24983808806827176,
        0.24957872267903955,
        0.24911103147186386,
        0.2497713488974224,
        0.2497547361651726,
        0.250712802064708,
        0.2502822696995085,
        0.24998285707268036,
        0.24980983149688238,
        0.24974786850578887,
        0.24927457505350115,
        0.24990376420475122,
        0.25077377805854445,
        0.24995394731723006,
        0.24960824603878964,
        0.2505814148713387,
        0.24987724137257086,
        0.2497974878739088,
        0.24996745321674285,
        0.25023925898230426,
        0.2505738233177764,
        0.24981686939776923,
        0.2500021280416901,
        0.25020256515548644,
        0.250108221434445,
        0.25037703045198034,
        0.25000709857448156,
        0.25074176934959796,
        0.2503578701404429,
        0.2507262025394611,
        0.25040059027966516,
        0.25046551661084787,
        0.2505144306512002,
        0.2504207509736049,
        0.250239800761351,
        0.25053215048228766,
        0.25016182517397767,
        0.25080770476355435,
        0.25111956662172624,
        0.2513249177943697,
        0.24990811202933128,
        0.25079907744120505,
        0.2509184250563615,
        0.24964108510701352,
        0.25095549153235247,
        0.2503497203311679,
        0.2509802555831995,
        0.25149828617102293,
        0.2516576136552662,
        0.25110342925321116,
        0.2509866298378861,
        0.2517794171941271,
        0.24902394996877217,
        0.2509326394850682,
        0.2515267663266998,
        0.25137353069416724,
        0.251338877127785,
        0.25162052084770364,
        0.25143861099460235,
        0.24890340804631103,
        0.25137002879090925,
        0.25174550573124604,
        0.2516611332874276,
        0.2521638794355233,
        0.2521938716456538,
        0.2510204557663366,
        0.25149318151700156,
        0.25244389868648404,
        0.2525029008534299,
        0.2526764513881311,
        0.25163615350417357,
        0.2515405868538913,
        0.25209813487783467,
        0.2525415715154324,
        0.2513085924614399,
        0.2523802504174973,
        0.25200155903136284,
        0.25220258582158045,
        0.25249729693705003,
        0.25212065171092113,
        0.25157010279302555,
        0.2519852958968137,
        0.25188925571927506,
        0.2524141593569035,
        0.2520647176587177,
        0.25209289041816285,
        0.25225107296504856,
        0.25185039508680657,
        0.25180385025193747,
        0.2514648170042124,
        0.2520059081163538,
        0.2446185605000545,
        0.25231265795349705,
        0.252100082501646,
        0.25193961738536075,
        0.25117086578659026,
        0.2520959000173259,
        0.25216167722215066,
        0.2513078351995154,
        0.2522720567291813,
        0.25224872492916023,
        0.25235920277128615,
        0.25114758659096276,
        0.2523458478645361,
        0.25186294951795984,
        0.25258490936507055,
        0.2521174444809977,
        0.25223733321928316,
        0.2526114144431747,
        0.2524243218284005,
        0.25285020718559353,
        0.2525651239857855,
        0.2528656049700745,
        0.2517052159685047,
        0.252091030030144,
        0.25203170426908017,
        0.25187242150339606,
        0.25199217950934766,
        0.2521137851316097,
        0.25188183932329117,
        0.25251375702662593,
        0.25244809340335583,
        0.24689066722336525,
        0.252081511827048,
        0.2524360617975493,
        0.25196530334777056,
        0.25258931558079545,
        0.2524487517623178,
        0.2528190150388871,
        0.25206041525468525,
        0.25248224844539785,
        0.24988423091534384,
        0.2517873641489395,
        0.25193453175414793,
        0.25182570067644966,
        0.2522717348047443,
        0.25203324718806963,
        0.252329198748855,
        0.2521164085165015,
        0.25204747095907065,
        0.25244528949394685,
        0.2521532843729356,
        0.25197251658258424,
        0.25300530217944994,
        0.2528877840436832,
        0.2512068558736717,
        0.2516060594050236,
        0.2522086312965986,
        0.2527481502759644,
        0.25234194355380357,
        0.25239247704958373,
        0.25268410565010024,
        0.2528970989462049,
        0.25284099260812,
        0.25323053454972716,
        0.2533312499971712,
        0.24795125815343977,
        0.25251800256084633,
        0.252442283147353,
        0.2529963903848629,
        0.2531063879362399,
        0.2532308603730666,
        0.25269323182481623,
        0.2464396403535319,
        0.24968758281625358,
        0.25261881842726447,
        0.2527439465987589,
        0.2522297218521052,
        0.24898691294527373,
        0.24935342593205975,
        0.2524577861626434,
        0.2521777501300086,
        0.2524992657502404,